<?xml version="1.0" encoding="UTF-8"?>
<portafogli xmlns:xsi="http://www.w3.org/2001/XMLSchema-instance" xsi:noNamespaceSchemaLocation="./schemaPortafogliBonus.xsd">
    <portafoglio id_cliente="10" totale="4">
        <saldo anno="2023">1</saldo>
        <saldo anno="2024">3</saldo>
    </portafoglio>

    <portafoglio id_cliente="50" totale="3">
        <saldo anno="2024">3</saldo>
    </portafoglio>

    <portafoglio id_cliente="23" totale="10">
        <saldo anno="2022">3</saldo>
        <saldo anno="2023">1</saldo>
        <saldo anno="2024">6</saldo>
    </portafoglio>
</portafogli>
